{
  "opendb_id": "1781946f-2105-4f77-a3f2-30fba4e9f3a6",
  "ear_pad_material": [],
  "connection_types": [],
  "features": [],
  "use_cases": [],
  "platforms": [],
  "lighting": [],
  "metadata": {
    "name": "HP HyperX Cloud Stinger Gaming Headset",
    "manufacturer": "HP",
    "part_numbers": [
      "HX-HSCSW2-BK",
      "WW                                                    HX-HSCSW2-BK",
      "NA"
    ]
  },
  "general_product_information": {},
  "identifiers": {
    "version": 1,
    "identifiers": [
      {
        "type": "mpn",
        "value": "HX-HSCSW2-BK",
        "region": "all"
      },
      {
        "type": "mpn",
        "value": "NA",
        "region": "all"
      },
      {
        "type": "mpn",
        "value": "WW                                                    HX-HSCSW2-BK",
        "region": "all"
      }
    ],
    "retailer_listings": []
  }
}
