{
  "opendb_id": "42d57f27-0615-4bfb-a48b-28441affaee6",
  "ear_pad_material": [],
  "connection_types": [],
  "features": [],
  "use_cases": [],
  "platforms": [],
  "metadata": {
    "name": "Koss Cs100 Closed Headphones",
    "manufacturer": "Koss",
    "part_numbers": ["IVG-KSSCS100"]
  },
  "general_product_information": {},
  "identifiers": {
    "version": 1,
    "identifiers": [
      {
        "type": "mpn",
        "value": "IVG-KSSCS100",
        "region": "all"
      }
    ],
    "retailer_listings": []
  }
}
