{
  "opendb_id": "357f5428-ccfd-44b5-b982-111ce4682712",
  "ear_pad_material": [],
  "connection_types": [],
  "features": [],
  "use_cases": [],
  "platforms": [],
  "lighting": [],
  "metadata": {
    "name": "1MORE Triple Driver (Silver) In Ear  With Microphone",
    "manufacturer": "1MORE",
    "part_numbers": ["E1001-SV"]
  },
  "general_product_information": {},
  "identifiers": {
    "version": 1,
    "identifiers": [
      {
        "type": "mpn",
        "value": "E1001-SV",
        "region": "all"
      }
    ],
    "retailer_listings": []
  }
}
