{
  "opendb_id": "e62a2adc-3ba1-4df3-a3c4-af908ef152ee",
  "ear_pad_material": [],
  "connection_types": [],
  "features": [],
  "use_cases": [],
  "platforms": [],
  "lighting": [],
  "metadata": {
    "name": "Mad Catz F.R.E.Q. 7 7.1 Channel Closed Gaming Headset",
    "manufacturer": "Mad Catz",
    "part_numbers": ["MCB4340200C2", "02", "1"]
  },
  "general_product_information": {},
  "identifiers": {
    "version": 1,
    "identifiers": [
      {
        "type": "mpn",
        "value": "02",
        "region": "all"
      },
      {
        "type": "mpn",
        "value": "1",
        "region": "all"
      },
      {
        "type": "mpn",
        "value": "MCB4340200C2",
        "region": "all"
      }
    ],
    "retailer_listings": []
  }
}
