{
  "opendb_id": "774af42f-72e0-45fc-93eb-fa2128f65208",
  "ear_pad_material": [],
  "connection_types": [],
  "features": [],
  "use_cases": [],
  "platforms": [],
  "lighting": [],
  "metadata": {
    "name": "Corsair HS65 7.1 Channel Closed-Back Gaming Headset",
    "manufacturer": "Corsair",
    "part_numbers": [
      "CA-9011285-NA                                                    CA-9011285-EU"
    ]
  },
  "general_product_information": {},
  "identifiers": {
    "version": 1,
    "identifiers": [
      {
        "type": "mpn",
        "value": "CA-9011285-NA                                                    CA-9011285-EU",
        "region": "all"
      }
    ],
    "retailer_listings": []
  }
}
