{
  "opendb_id": "a372eaf5-7559-4192-a001-427f9997263c",
  "ear_pad_material": [],
  "connection_types": ["Bluetooth", "USB-C"],
  "features": [],
  "use_cases": [],
  "platforms": [],
  "lighting": [],
  "metadata": {
    "name": "REDMI Headphones Neo Blue",
    "manufacturer": "Xiaomi",
    "part_numbers": [],
    "series": "Headphones Neo",
    "variant": "Blue"
  },
  "general_product_information": {
    "manufacturer_url": "https://www.mi.com/it/product/redmi-headphones-neo/"
  },
  "identifiers": {
    "version": 1,
    "identifiers": [
      {
        "type": "ean",
        "value": "6932554487478",
        "region": "all"
      }
    ],
    "retailer_listings": [
      {
        "source": "xiaomi",
        "channel": "es",
        "source_product_id": "73671",
        "pricing_enabled": true,
        "verified": true
      },
      {
        "source": "xiaomi",
        "channel": "it",
        "source_product_id": "73671",
        "pricing_enabled": true,
        "verified": true
      }
    ]
  }
}
