{
  "opendb_id": "0245e3dc-7ab2-4f6e-9e8f-80031becd29c",
  "ear_pad_material": [],
  "connection_types": [],
  "features": [],
  "use_cases": [],
  "platforms": [],
  "lighting": [],
  "metadata": {
    "name": "Logitech G435 Headset",
    "manufacturer": "Logitech G",
    "part_numbers": ["981-001061"]
  },
  "general_product_information": {},
  "identifiers": {
    "version": 1,
    "identifiers": [
      {
        "type": "ean",
        "value": "0097855168221",
        "region": "all"
      },
      {
        "type": "mpn",
        "value": "981-001061",
        "region": "all"
      },
      {
        "type": "upc",
        "value": "097855168221",
        "region": "all"
      }
    ],
    "retailer_listings": [
      {
        "source": "adorama",
        "channel": "us",
        "source_product_id": "LO981161",
        "pricing_enabled": true,
        "verified": false
      },
      {
        "source": "amazon",
        "channel": "au",
        "source_product_id": "B08R8GJPC2",
        "pricing_enabled": true,
        "verified": true
      },
      {
        "source": "amazon",
        "channel": "be",
        "source_product_id": "B08R8GJPC2",
        "pricing_enabled": true,
        "verified": true
      },
      {
        "source": "amazon",
        "channel": "ca",
        "source_product_id": "B08R8GJPC2",
        "pricing_enabled": true,
        "verified": true
      },
      {
        "source": "amazon",
        "channel": "de",
        "source_product_id": "B08R8GJPC2",
        "pricing_enabled": true,
        "verified": true
      },
      {
        "source": "amazon",
        "channel": "es",
        "source_product_id": "B08R8GJPC2",
        "pricing_enabled": true,
        "verified": true
      },
      {
        "source": "amazon",
        "channel": "fr",
        "source_product_id": "B08R8GJPC2",
        "pricing_enabled": true,
        "verified": true
      },
      {
        "source": "amazon",
        "channel": "ie",
        "source_product_id": "B08R8GJPC2",
        "pricing_enabled": true,
        "verified": true
      },
      {
        "source": "amazon",
        "channel": "it",
        "source_product_id": "B08R8GJPC2",
        "pricing_enabled": true,
        "verified": true
      },
      {
        "source": "amazon",
        "channel": "jp",
        "source_product_id": "B08R8GJPC2",
        "pricing_enabled": true,
        "verified": true
      },
      {
        "source": "amazon",
        "channel": "nl",
        "source_product_id": "B08R8GJPC2",
        "pricing_enabled": true,
        "verified": true
      },
      {
        "source": "amazon",
        "channel": "pl",
        "source_product_id": "B08R8GJPC2",
        "pricing_enabled": true,
        "verified": true
      },
      {
        "source": "amazon",
        "channel": "se",
        "source_product_id": "B08R8GJPC2",
        "pricing_enabled": true,
        "verified": true
      },
      {
        "source": "amazon",
        "channel": "sg",
        "source_product_id": "B08R8GJPC2",
        "pricing_enabled": true,
        "verified": true
      },
      {
        "source": "amazon",
        "channel": "uk",
        "source_product_id": "B08R8GJPC2",
        "pricing_enabled": true,
        "verified": true
      },
      {
        "source": "amazon",
        "channel": "us",
        "source_product_id": "B08R8GJPC2",
        "pricing_enabled": true,
        "verified": true
      },
      {
        "source": "bestbuy",
        "channel": "us",
        "source_product_id": "6478275",
        "pricing_enabled": true,
        "verified": false
      },
      {
        "source": "walmart",
        "channel": "us",
        "source_product_id": "101485946",
        "pricing_enabled": true,
        "verified": false
      }
    ]
  }
}
