{
  "opendb_id": "a01a75b4-8585-43d1-9d92-cc91bb2f23f8",
  "ear_pad_material": [],
  "connection_types": [],
  "features": [],
  "use_cases": [],
  "platforms": [],
  "lighting": [],
  "metadata": {
    "name": "Corsair VOID 7.1 Channel Closed Headset",
    "manufacturer": "Corsair",
    "part_numbers": [
      "CA-9011130-NA                                                    CA-9011130-EU",
      "CA‐9011130‐NA",
      "CA-9011130-NA"
    ]
  },
  "general_product_information": {},
  "identifiers": {
    "version": 1,
    "identifiers": [
      {
        "type": "ean",
        "value": "0843591053044",
        "region": "all"
      },
      {
        "type": "mpn",
        "value": "CA-9011130-NA",
        "region": "all"
      },
      {
        "type": "mpn",
        "value": "CA-9011130-NA                                                    CA-9011130-EU",
        "region": "all"
      },
      {
        "type": "mpn",
        "value": "CA‐9011130‐NA",
        "region": "all"
      },
      {
        "type": "upc",
        "value": "843591053044",
        "region": "all"
      }
    ],
    "retailer_listings": [
      {
        "source": "amazon",
        "channel": "au",
        "source_product_id": "B013GMXA2I",
        "pricing_enabled": true,
        "verified": true
      },
      {
        "source": "amazon",
        "channel": "be",
        "source_product_id": "B013GMXA2I",
        "pricing_enabled": true,
        "verified": true
      },
      {
        "source": "amazon",
        "channel": "ca",
        "source_product_id": "B013GMXA2I",
        "pricing_enabled": true,
        "verified": true
      },
      {
        "source": "amazon",
        "channel": "de",
        "source_product_id": "B013GMXA2I",
        "pricing_enabled": true,
        "verified": true
      },
      {
        "source": "amazon",
        "channel": "es",
        "source_product_id": "B013GMXA2I",
        "pricing_enabled": true,
        "verified": true
      },
      {
        "source": "amazon",
        "channel": "fr",
        "source_product_id": "B013GMXA2I",
        "pricing_enabled": true,
        "verified": true
      },
      {
        "source": "amazon",
        "channel": "ie",
        "source_product_id": "B013GMXA2I",
        "pricing_enabled": true,
        "verified": true
      },
      {
        "source": "amazon",
        "channel": "it",
        "source_product_id": "B013GMXA2I",
        "pricing_enabled": true,
        "verified": true
      },
      {
        "source": "amazon",
        "channel": "jp",
        "source_product_id": "B013GMXA2I",
        "pricing_enabled": true,
        "verified": true
      },
      {
        "source": "amazon",
        "channel": "nl",
        "source_product_id": "B013GMXA2I",
        "pricing_enabled": true,
        "verified": true
      },
      {
        "source": "amazon",
        "channel": "pl",
        "source_product_id": "B013GMXA2I",
        "pricing_enabled": true,
        "verified": true
      },
      {
        "source": "amazon",
        "channel": "se",
        "source_product_id": "B013GMXA2I",
        "pricing_enabled": true,
        "verified": true
      },
      {
        "source": "amazon",
        "channel": "sg",
        "source_product_id": "B013GMXA2I",
        "pricing_enabled": true,
        "verified": true
      },
      {
        "source": "amazon",
        "channel": "uk",
        "source_product_id": "B013GMXA2I",
        "pricing_enabled": true,
        "verified": true
      },
      {
        "source": "amazon",
        "channel": "us",
        "source_product_id": "B013GMXA2I",
        "pricing_enabled": true,
        "verified": true
      },
      {
        "source": "walmart",
        "channel": "us",
        "source_product_id": "159786690",
        "pricing_enabled": true,
        "verified": false
      }
    ]
  }
}
